Nebelivka,Assembly Houses,"Assembly (local),Public meetings","Equality in opportunity,Egalitarianism,Free Speech,Innovation,Cooperation,Diversity","Graeber and Wengrow on Nebelivka type of mega-site:

-	In the absence of written records (or a time machine), there are serious limits to what we can say about kinship and inheritance, or how people in these cities went about making collective decisions. (Graeber and Wengrow, p. 294)
-	Still, some clues exist, beginning at the level of individual households. (Graeber and Wengrow, p. 294)
-	Each of these had a roughly common plan, but each was also, in its own way, unique.
-	From one dwelling to the next there is constant innovation, even playfulness, in the rules of commensality. (Graeber and Wengrow, p. 294)
-	Each family unit invented its own slight variations on domestic rituals, reflected in its unique assemblage of serving and eating vessels, painted with polychrome designs of often mesmerising intensity and made in a dazzling variety of forms. (Graeber and Wengrow, p. 294)

-	Individual households would sometimes opt to cluster together in groups of between three and ten families. (Graeber and Wengrow, p. 294)
-	Ditches or pits marked their boundaries. (Graeber and Wengrow, p. 294)
-	At some sites these groups coalesce into neighbourhoods, radiating out from the centre to the perimeter of the city, and even forming larger residential districts or quarters. (Graeber and Wengrow, p. 294)
-	Each had access to at least one assembly house, a structure larger than an ordinary dwelling where a wider sector of the population might gather periodically for activities we can only guess at. (Graeber and Wengrow, p. 295)
---------------------------------------------------------

Nebelivka is a mega-site from the Cucuteni-Tripolye culture. A number of other mega-sites have also been documented. Maidanetske seems to be a recreation of Nebelivka's spatial structure a century or two later (there are perimeter boundaries and Assembly Houses creating a 'House -> Neighbourhood -> Quarter -> City' structure). Dobrovody has a similar number of Assembly Houses as Maidanetske, but is missing perimeter boundaries common to the structures of Nebelivka and Maidanetske. Taljanky, the largest mega-site, does not seem to have either of these features. 


-	By 4500 BC, chernozem was widely distributed between the Carpathian and the Ural Mountains, where a mosaic landscape of open prairie and woodland emerged capable of supporting dense human habitation. (Graeber and Wengrow, p. 290)
-	The Neolithic people who settled there had travelled east from the lower reaches of the Danube, passing through the Carpathian Mountains. (Graeber and Wengrow, p. 291)
-	We do not know why, but we do know that – throughout their peregrinations in river valleys and mountain passes – they retained a cohesive social identity. (Graeber and Wengrow, p. 291)
-	Their villages, often small in scale, shared similar cultural practices, reflected in the forms taken by their dwellings, female figurines and ways of making and serving food. (Graeber and Wengrow, p. 291)
-	The archaeological name given to this particular ‘design for life’ is the Cucuteni-Tripolye culture, after the sites where it was first recorded. (Graeber and Wengrow, p. 291)

-	So the Ukrainian and Moldovan mega-sites did not come out of thin air. (Graeber and Wengrow, p. 291)
-	They were the physical realisation of an extended community that already existed long before its constituent units coalesced into large settlements. (Graeber and Wengrow, p. 291)
-	Some tens of these settlements have now been documented. (Graeber and Wengrow, p. 291)
-	The biggest currently known – Taljanky – extends over an area of 300 hectares, outspanning the earliest phases of the city of Uruk in southern Mesopotamia. (Graeber and Wengrow, p. 291)
-	It presents no evidence of central administration or communal storage facilities. (Graeber and Wengrow, p. 291)
-	Nor have any government buildings, fortifications or monumental architecture been found.
-	There is no acropolis or civic centre. (Graeber and Wengrow, p. 291)

- In the same two mega-sites with perimeter boundaries —Nebelivka and Maidanetske—a similar pattern of spatial division has been recognized based on four spatial levels—the house, the Neighbourhood, the Quarter, and the entire site (Chapman et al., 2014, 2014a; Ohlrau, 2014). (Chapman, p. 128)

- Turning to the later, Phase CI mega-sites, the basic Nebelivka spatial structure was re-created a century or two later at Maidanetske, with an estimated total of fifteen Assembly Houses and a maximum mean ratio of almost 200 houses per Quarter (Ohlrau, 2014). (Chapman, p. 129)
- A similar number of Assembly Houses is estimated for Dobrovody (Rassmann et al., 2014: 126). (Chapman, p. 129)
- It is even more intriguing, therefore, that only one possible Assembly House has been recognized at Taljanky— after all, the largest known mega-site in the Trypillia world. (Chapman, p. 129)
- The missing perimeter ditch and the absent Assembly Houses at Taljanky seem to us to be two sides of the same coin—an alternative social structure in which different ways of integrating a large population were used in contrast to those at Nebelivka and Maidanetske. (Chapman, p. 129)

- The presence of a perimeter boundary at two mega-sites—Nebelivka and Maidanetske—and their absence from the other two—Taljanky and Dobrovody—suggests major differences in social practices on these sites and the means that they used to integrate subgroups with(out) communal building projects. (Chapman, p. 129)
- The same is true for the absence from Taljanky of Assembly Houses, when these large structures were of such obvious social significance for the mega-sites of Nebelivka, Maidanetske, and Dobrovody. (Chapman, p. 129)

- This is not to say that all mega-structures, whether at Nebelivka or at other mega-sites, will produce identical excavated results. (Chapman, p. 129)
- Yet the first excavation of such a mega-structure has provided an intriguing combination of expanded scale and reduced object deposition. (Chapman, p. 129)
- Further post-excavation studies will doubtless enable us to add more texture and colour to this provocative initial sketch, which contributes another layer of interpretation to the debate on Trypillia ‘urbanism’. (Chapman, p. 129)
---------------------------------------------

Establishment of Nebelivka Quarters:

- Assembly houses were located at a variety of spacings around the outer and inner house circuits. (Chapman, p. 128)
- They occurred in varying combinations: six isolates, five pairs, two trios, and one area with no assembly houses at all. (Chapman, p. 128)
- We consider the location of assembly houses to be of critical importance for the spatial division of the outer and inner house circuits and inner radial streets into the second level of spatial order—the ‘Quarters’. (Chapman, p. 128)
- A critical question concerns the establishment of boundaries between the Nebelivka Quarters. (Chapman, p. 128)
Currently, eight criteria have been used to partition the mega-site into Quarters: (Chapman, p. 128)
(1) ‘Natural’ features, such as palaeo-channels (BUT there are only two palaeo-channels); 
(2) the border half-way between Assembly Houses (BUT this ignores local topographyphies); 
(3) the boundary between (pairs of) Assembly Houses (BUT sometimes there are three Assembly Houses or only one); 
(4) any large gaps between Neighbourhoods (BUT there is often a continuous spread of houses (e.g. E–F, F–G); 
(5) kinks in circuits (BUT these are absent in many parts of the circuit(s));
(6) major variations in the width of the middle (inter-circuit) space; 
(7) gaps in the ditch (BUT some one-third of the outer circuit has no surviving ditch); and 
(8) ‘Obvious’ entrances and passageways (BUT these gaps are not always obvious!).
----------------------------------------------
Assembly House technicalities:

- This mega-structure is currently the largest structure known from the Trypillia-Cucuteni group; the prima facie interpretation would be that such large buildings were some kind of ‘public’ building, performing integrative functions for several parts of the Nebelivka mega-site. (Chapman, p. 120)
- In summary, there were three final stages in the biography of the mega-structure: (Chapman, p. 125)
(1) the temporary or permanent cessation of social practices inside the building; 
(2) a period of as yet unknown duration allowing the build-up of thin levels of Chernozem derived soil layers within the mega-structure; perhaps the mega-structure was not used in this period; and 
(3) two stages of the collapse of the building to produce the ploshchadka.
---------------------------------------------------------","41st -34th century BC
(4100-3300 BC)",-4100,-3300,Europe East,"10,001 - 100,000","- John Chapman, Bisserka Gaydarska and Duncan Hale, Nebelivka: Assembly Houses, Ditches, and Social Structure

- David Graeber and David Wengrow, The Dawn of Everything","To follow up, one could look at Maidanetske. Or even Dobrovody and/or Taljanky. See notes for more.",,Edited May 23 (would be great to find additional material on assembly houses),,0,0,0,0,0,0,0,0,0,0,0,0,0,0,0,0,0,0,0,0,0,0,1,0,0,0,0,0,0,0,0,0,0,0,0,0,0,0,0,0,0,0,0,0,0,0,0,0,0,0,0,0,0,0,0,0,0,0,0,0,0,0,0,0,0,0,0,0,0,0,0,0,0,0,0,0,0,0,0,0,0,0,0,0,0,0,0,0,0,0,0,0,0,0,1,0,0,0,0,0,0,1,0,0,0,0,0,0,0,0,0,0,0,0,0,0,0,0,1,0,0,0,0,0,0,0,0,0,0,0,0,0,0,0,0,0,0,0,0,0,0,0,0,0,0,Europe,0,1,0,0,0,0,0,0,800
Negara Ubud,"Banjar (Hamlet),Subak (Irrigation society),Pemaksan,Dadia,Perbekel,Kilan Banjar,Krama banjar","Constitution,Election,Assembly (local),Council (local),Fines,Heredity,Self-help,King(chief)-as-Figurehead,Representation,Consensus,Frequent and/or regular meetings,Suspension/Expulsion/Ostracism/Proscription,Criticism/Mocking/Joking,Assembly (elite)","Unwritten rules,Obedience to authority,Ritual","Village republics
Composed of banjar (hamlets, with a political function), subak (irrigation society). Each village republic had a representation in the pemaksan. 

Institutional mechanisms in the Banjar (hamlet)
- The krama banjar was composed of the citizenry of the hamlet. A man became a member of this after getting married or having his first child. This ensured that each family had a representative in it.
- The krama banjar met once every 35 days, but special meetings could be called. It made all the important policy decisions with consensus. 
- The krama banjar elected the kilan banjar, a set of leaders (the number of which varied from hamlet to hamlet). They were less like rulers and more like the agents of the krama banjar, since they were responsible for the execution of the decisions made by the krama banjar. There were no codified rules dictating their actions, but the kilan banjar followed its own mode of procedure based on past traditions.  
- The krama banjar was ""the sovereign body in all hamlet affairs, ·punishing any incorrigible resistance to its authority, no matter how apparently trivial, by ostracism"" Thus, the banjar enforced its decisions by criticising and shunning those who did not abide by its dictates.  

Institutional mechanisms in the subak (irrigation society)
- the boundaries between rice fields and the extent/usage rights of each irrigation canal were very clearly defined in the constitution (awig-awig subak), which pre-empted water disputes. 
- Structure and powers identical to the hamlet : it had a krama subak, kilan subak and a constitution (awig-awig subak). However, while the domain of the hamlet was political, that of the subak was economic, specifically, the irrigation of rice fields. 
- the members of krama subak (irrigation assembly) did not include representation from all the village, but only large landowners and those who irrigated their terraces from a shared water source, making it an elite assembly. 
- However, its authority and cultural importance was at par with the hamlet's : ""as in the hamlet, in the sphere of life where public rights and public interests were conceived to be dominant its word was law, defiance of its word crime.""

Relation of Pemaksan to the village republic
""Like the hamlet and the irrigation society, the pemaksan is corporate; like them, it is specifically directed toward certain limited, well defined ends; and, like them, it is essentially autonomous. Its political importance derives from its role as a spiritual group, as theirs derives from their role as a governmental or pro­ductive group."" (pg. 53)",19th century AD,1800,1900,"Asia Southeast, Bali",Unknown,"Geertz, Clifford, (1980) Negara: The Theatre-state in Nineteenth-century Bali","The exact number of hamlets, which were the essential unit of the village republic ranges widely (from hundreds to thousands according to Geertz). [this is why the size is unknown]

The organisation of the centralised powers in Negara Ubud is not backed by evidence of their actually being put into practise. The overarching system of the raja (king) with a kerajaan (kingdom) is an idealised and necessarily abstract model. Thus, Geertz refers to it ""as a conceptual entity not an historical one."" This is further bolstered by MacRae's argument that the Negara Ubud extended into the 21st century, since even after colonial powers took over, the functioning of the village republics and dadia remained unaltered.  

HETEROGENEITY
- There were separate representation mechanisms for the wealthier farmers in the irrigation society (subak) and for all the families in the village in the banjar. This shows that there was formal inclusion through different institutions. However, the word of the councils was adhered to by all the members of the community, indicating that there was no political cleavage. ","Social groups,Inclusion through different institutions,Heterogenous without political cleavages,Formal inclusion",Edited May 23,,0,1,0,1,0,0,1,0,0,0,0,0,0,0,0,0,1,0,0,0,0,0,0,0,0,0,1,0,1,0,0,0,0,0,1,0,0,0,0,0,0,0,0,0,0,1,0,0,0,0,0,1,0,0,0,0,0,0,0,0,0,1,0,0,0,0,0,0,0,0,0,0,0,1,0,0,0,0,0,0,0,0,0,0,0,0,0,0,0,0,0,0,0,0,1,0,0,1,1,0,0,0,0,0,0,1,0,0,0,0,0,0,0,0,0,0,0,0,0,0,0,0,0,0,0,0,0,0,0,0,0,0,0,0,0,0,0,0,0,0,1,0,0,0,0,Asia,0,0,1,0,0,0,0,0,100
Nlaka'pamux,"Informal Councils,War-chief,""Hunting """"chief"""""",""""""Chief"""" of the ceremonies and dances"",Orators","Leader (first among equals),Meritocracy,Voting,Election,Co-optation,Reputational risk,Temporary position of power/Term Limits,Public meetings,Gerontocracy,Consultation,Deliberation,Popularity ,Council (local)","Equality in opportunity,Reputation/Honour,Shared identity/Kinship,Supernatural,Ritual","Nlaka'pamux are referred to as 'Thompson Indians of British Columbia' in many western sources.

- ""The Thomspon Indians had neither hereditary chiefs nor a recognised nobility."" (Teit, p. 289)
- ""The rank of each person was determined by his wealth and his personal qualities."" (Teit, p. 289)
- ""Their ""chiefs"" were therefore men of the tribe noted for wealth, wisdom, oratorical powers, or prowess in war"". (Teit, p. 289)
- All of the decisions were conducted collectively by all the men of the tribe at the Informal Council, where each man had a voice.

In Jorgensen (1980) Upper Thompson are coded alongside such tribes as Haida, Tlingit and Klamath as '14' for Politics. These other tribes, however, have not been researched by Liza, but are likely to have similar institutions to Thompson. See Google Sheet on North American Tribes.",18th-19th century AD,1700,1900,North America,"1,001 - 10,000","'- Thompson Indians of British Columbia by James Teit written in 1895 and 1897
https://babel.hathitrust.org/cgi/pt?id=aeu.ark:/13960/t0tq6f09g&view=1up&seq=153&skin=2021
- Jorgensen, Joseph, Western Indians: Comparative Environments, Languages, and Cultures of 172 Western American Indian Tribes (1980)","HETEROGENEITY
- Informal inclusion and Systemic power imbalance for Gender groups 
Women were said to advise and support men, but “had no say in any matters of importance.” Women could also not be chiefs. 
Institutions only represented men and thus, while there is informal inclusion of women, men are evidently more powerful. 

- Informal inclusion and informal power balance for the group of more intelligent/wiser members. 
Experienced and wise men were consulted by the chiefs in an informal council. This was significant because it was this informal council that chose the war-chief. 
Furthermore, another way of informal (at least from a political point of view) inclusion of intelligent citizens was through the custom of having orators. They are described as “wise and wealthy,” and make speeches that have the power to influence public opinion. 
Therefore, informal inclusion leads to an informal power balance in favour of the wise and learned group of people within the community. ","Gender groups,Informal inclusion,Systemic power imbalance,Social groups,Informal power imbalance ",Edited may 23,,0,0,1,0,0,0,0,0,0,0,0,0,0,0,0,0,1,1,0,0,0,0,1,0,0,0,1,0,0,0,0,0,0,0,0,1,0,0,0,0,0,1,0,0,1,0,0,0,0,0,0,0,0,0,0,0,0,0,0,0,0,0,0,0,0,0,0,1,0,0,1,0,0,0,0,0,1,0,0,1,0,0,0,0,0,0,0,0,1,0,0,0,0,0,0,0,0,0,0,0,1,0,0,0,0,0,0,0,0,0,0,0,0,0,0,0,0,0,0,0,0,0,0,0,1,0,0,0,0,0,0,0,0,0,0,0,0,0,0,0,0,0,0,0,0,North America,0,0,0,0,1,0,0,0,200
Oaxaca,"Assembly,Mexican state,Mayoral Elections,Cargos or Tequio,Dispute reoslution system","Assembly (local),Meritocracy,Turnover/rotation,Election,Consultation,Deliberation,Vote by show of hands,Frequent and/or regular meetings,Public meetings,Secret ballot","Egalitarianism,Cooperation","Population of Oaxaca estimated at 300,000 in 2014 (wikipedia)

The Magaloni/Diaz-Cayeros papers focus on a constitutional reform in 1995 which formally validated traditional governance
structures, in what is known as usos y costumbres. The institution was originally precolonial. 

Of the 570 municipalities in that state, 418 adopted usos y costumbres. p. 1846","20th century -present
(the usos was reestablished in 1995, but the institution is historical in origins. awaiting further info on historical usos)",1900,2000,"Central America, Mexico","100,001 - 1,000,000","Magaloni et al. 2019 Public Good Provision and Traditional
Governance in Indigenous Communities in Oaxaca, Mexico

See also Valley of Oaxaca
http://seshatdatabank.info/databrowser/valley-of-oaxaca.html",,,Edited May 23,,0,0,0,0,0,0,0,0,0,0,0,0,0,0,0,0,1,0,0,0,0,0,1,0,1,0,0,1,0,0,0,0,0,0,0,1,0,1,0,0,0,0,0,0,1,1,0,0,0,0,0,0,0,0,0,0,0,0,0,0,0,0,0,0,0,0,0,0,0,0,0,0,0,0,0,0,0,0,0,1,0,0,0,0,0,0,0,0,0,0,0,0,0,0,1,0,0,0,0,0,0,0,1,0,0,0,0,0,0,0,0,0,0,1,0,0,0,0,0,0,0,0,0,0,0,0,0,0,0,0,0,0,0,0,0,0,0,0,0,0,0,0,0,0,0,Central America,0,0,0,0,0,1,0,0,100
Pathan Hill Tribes/Pashtuns,"Pukhtunwali,Jirga,Malik,Lashkar,Mullah","Leader (first among equals),Council (local),Gerontocracy,Public meetings,Deliberation,Self-help,Suspension/Expulsion/Ostracism/Proscription,Reputational risk,Capital punishment,Destruction of property,Arbitration,Fines,Balance of power,Constitution","Reputation/Honour,Obedience to authority,Revenge,Unwritten rules,Egalitarianism","'Within the Pathan Hill tribes, the distinction between state-administered ostracism and ostracism by the community does not exist' (p. 148)

They 'choose to do without a state apparatus because
they wish to retain the maximum degree of individual freedom.' (p. 148)

Strong culture of honour which impacts the way enforcement is carried out

'""Pukhtunwali,"" the Code of the Pathans, regulates the uses of ostracism, as a response to the conflict between an individual's desire for freedom and the necessity of tribal unity.' (p. 147)
- May occur when a member acts in a way that may lead to feud

'Obedience to Pukhtunwali is freely given. If a Pathan does not wish to live by the Code, he can leave the Tribal Area and move to anywhere in Pakistan; as long as a Pathan lives in the Tribal Area, however, he is obligated to follow the rules of Pukhtunwali.' (p. 149)
- In the first instance, obedience is secured through 'honour' not coercive force

There is no central institution which enforces compliance. Each member is an agent

The most common form of punishment is revenge killing, called 'badal'
- Can be carried out by the closest individual, the 'family, section, clan, or tribe' (p. 150)
- Social or economic status doesn't deter other agents from carrying out badal. However, if the target is well-protected, justice may be carried out on his kin

Badal may have adverse effect on the economy, as targets would rather hide from potential attackers than to tend to their fields.
- Therefore, there exists a possibility for mediation through the Council of Elders, 'Jirga'. It may arrange a truce or termination of hostilities. 'Certain conditions, such as monetary compensation, may be imposed to achieve a balance in the redress of grievances.' (p. 151)
- 'Once a party has submitted to arbitration by Jirga, it is bound to follow the Jirga's ruling.' (p. 152) Violation of rulings may lead to a fine or to a burning of the resisters' homes.
- Enforcement of Jirga's rulings may be supported by 'lashkar', a levied force from the tribe

Social shunning for minor offences is done covertly and does not have the same severity as in other communities
- 'The unique expression of overt, verbal disapproval that is practiced is ""paighor"" (insult or taunt).' (p. 155)
- 'if a Pathan misbehaves in a way that is an irritant to the community, rather than resort to ostracism of the culprit, the group can attempt to remedy the situation through ""gila"" (complaint).' (p. 155)",Contemporary (20th century),1900,2023,"Asia, India","10,000,000+","Mahdi, Niloufer Qasim (1986), Pukhtunwali: Ostracism and Honor among the Pathan Hill Tribes

Ginsburg, T. 2011. An Economic Interpretation of the Pashtunwali",,,Edited May 23,,0,1,1,0,0,0,0,0,0,1,0,0,0,0,0,1,0,1,0,0,0,0,1,0,0,0,1,0,1,0,0,0,0,0,1,1,0,0,0,0,0,0,0,0,0,0,0,0,0,0,0,1,1,0,0,0,0,0,0,0,0,0,0,0,0,0,0,1,0,0,0,0,0,0,0,0,0,0,0,0,0,0,0,0,0,0,0,0,0,0,0,0,0,1,0,0,0,0,0,0,0,0,0,0,1,0,0,0,0,0,0,0,0,0,0,0,0,0,0,0,0,0,0,0,0,0,0,0,0,0,0,0,0,0,0,0,0,0,0,0,0,1,0,0,0,Asia,0,0,1,0,0,0,0,0,123
Phoenicia,"Council of Elders,King,Assemblies","Autocratic Leader/Chief (bound),Council (central) ,Consultation,Deliberation",Ritual,"Group of independent city-states, later tributaries to Assyrian empire from the 9th century BC

There is variation across city states and over time. On balance, Phoenician city states are run by Kings and councils. In time, the power of the kings wanes and assemblies representing the people may have arisen in some city states around the 4th century. their functions are not clear.

From the Amarna letters, referring to early period (14th c): 'Their city-states were predominantly monarchic, and their kings had civic and commercial functions as well as ritual and religious responsibilities.' (Stockwell (2011), p. 37)

Traders 'formed councils to assist the kings in the management of complexities of their cities, and consequently they gained some power' (p. 37)

'The Amarna Letters contain references to councils of elders, or magnates, with whom local kings consulted on important matters of the state and who could even frustrate a king’s will' (p. 38)

From later developments: 

'some Phoenician municipalities were ruled, from time to time, by sovereign assemblies with deliberative functions; and the participation of citizens, and thus democratic activity, is evident in the earliest period of the Phoenician city-states.' (p. 39)

The city of 'Tyre was ‘a republic headed by elective magistrates’ at this period (Bondi, 2001: 153).' (p. 40) [6th ce.]
- Governed by suffetes 

'There is a lack of evidence as to how broadly these institutions represented the populace and how free and unconstrained their deliberations were, but on balance it may be concluded, from the few occasions when the people are visible, that Byblos, Sidon and Tyre, at least, had something more than an autocracy or oligarchy and much closer to democracy.' (p. 42)","16th -4th century BC
(1550 - 300 BC)",-1550,-300,Middle East MENA,"100,001 - 1,000,000","Stockwell, Stephen (2011), Before Athens: Early Popular Government in Phoenicia and Greek City-State. Geopolitics, history, and international relations, 2010, Vol.2 (2), p.123-135.

See also Stockwell's chapter on Israel and Phoenicia in The Edinburgh Companion to the History of Democracy 2015.

see also Niemeyer in Hansen, A Comparative Study of Thirty City-States Culture",,,Edited Feb 23,,0,0,0,0,0,0,0,0,0,0,0,0,0,0,0,0,0,0,0,1,0,0,0,0,0,0,0,0,0,0,0,0,0,0,0,1,0,0,0,0,0,0,0,0,1,0,0,0,0,0,0,0,0,0,0,0,0,0,0,0,0,0,0,0,0,0,0,0,0,0,0,0,0,0,0,0,0,0,0,0,0,0,0,0,1,0,0,0,0,0,0,0,0,0,0,0,0,0,0,0,0,0,1,0,0,0,0,0,0,0,0,0,0,0,0,0,0,0,0,0,0,0,0,0,0,0,0,0,0,0,0,0,0,0,0,0,0,0,0,0,0,0,1,0,0,Middle East,0,0,0,1,0,0,0,0,1250
