Imperial and Free Towns of the Holy Roman Empire,"Stadtrat,Burgermeister,Ratsherren,Guilds' representatives","Magistrate/official,President/Consul/Chief Executive,Council (central) ","Shared identity/Kinship,Written rules,Cooperation,Loyalty/Patriotism","The label ""Imperial and Free Towns"" refers to ca. 50-100 (# declining over time) towns (of the maybe 4000 in the empire as a whole). Cologne is the biggest.

Imperial towns recognized the emperor as their lord. The free towns did not (p. 296-7). the distinction fades with time.

Population numbers vary: 11 cities with more than 20,000 people; 15 with 10-20K; and over 70 with 5-10K. Size reflect the preponderance of smaller units.
",13th - 18th century AD,1200,1800,Europe West,"1,001 - 10,000","Peter Johanek, Imperial and Free Towns of the Holy Roman Empire, in Hansen, A Comparative Study of Thirty City-States Cultures",,,Edited March 23,,0,0,0,0,0,0,0,1,0,0,0,0,0,0,0,0,0,0,0,0,0,0,0,0,0,0,0,0,0,0,0,0,0,0,0,0,0,0,0,0,0,0,0,0,0,0,0,0,0,0,0,0,0,0,0,0,0,0,0,0,0,0,0,0,0,0,0,0,0,0,0,0,0,0,0,0,0,0,0,0,0,0,0,0,1,0,0,0,0,0,1,0,0,0,0,0,0,0,0,0,1,0,0,0,0,0,0,0,0,1,0,0,0,0,0,0,0,0,0,0,0,0,0,0,0,0,0,0,0,0,0,0,0,0,0,0,0,0,0,0,0,0,0,0,0,Europe,0,1,0,0,0,0,0,0,600
Indian Republics,"Rajan,Sabhā,Samiti","Autocratic Leader/Chief (bound),Council (central) ,Assembly (central),Unanimity,Majority voting,Meritocracy,Heredity","Strict hierarchy/caste system,Ritual,Egalitarianism","Ecology of several independent units governed through, broadly speaking, republican institutions. We know most about the Sakyias and Vajjians. Model seems to originate in the Buddhist brotherhood.

from Sharma 1968:
Gana and Sangha are terms used to refer to the republican system of government or the state itself, in which “the supreme power was vested in a considerable portion of the population so qualified only on account of their birth, property or merit. The supreme power was exercised by a few of these rajas, elected from among themselves and more or less responsible to the qualified body who deliberated and took, in consultation with the latter, decisions that were binding on the entire population. The rulers derived their power, not from an individual, human or divine, above them, but from the qualified multitude. In short, it was a “government by discussion.”” p. 12

There are four different forms of such government by discussion in the early vedic period (1500-1000 BC) and a number of republican states still in the Buddhist period (600 – 480 BC)

1.	King, appointed for life by vis (more likely, the elders/heads of families.
a.	This type is widespread in the vedic period
2.	Government by a sabha (council) in a form of aristocratic oligarchy
3.	Government by a sabha (council) and a samiti (Assembly)
a.	In this form of government, the sabha holds the greatest authority
4.	Government by an assembly and an unspecified number of kings (rajanah)

Only types 2-4 are relevant here.

From Stasavage, pp. 36-7
'Rhys Davids highlighted the example of the Shakya—the clan of the buddha. The business of the clan took place in an assembly where both young and old were present, and it must have included taxation. The clan elected a single chief—known as the raja—to run the assembly sessions and to preside over the business of state. Rhys Davids thought that the raja must have had a position like a Roman consul—a presiding officer but not truly a superior.' (p. 36) 'the same texts also describe village governance involving an assembly of all householders' (p. 37)

From Muhlberger 1998
'The largest and most influential Indian literary tradition, the Brahmanical, is distinctly hostile to anything resembling democracy.' (p. 3)
- 'Brahmanical literature gives kingship a central place in political life, and seldom hints that anything else is possible. For moral philosophers and legislators such as Manu (reputed author of the Manu-Smrti between 200 B.C.-A.D. 200), the king was a key figure in a social order based on caste (varna).' (p. 3)
- 'Caste divided society into functional classes: the Brahmans had magical powers and priestly duties, the ksatriyas were the rulers and warriors, the vaisyas cultivators, and the sudras the lowest part of society, subservient to the other three. Moral law or dharma depended on the observance of these divisions, and the king was the guarantor of dharma, and in particular the privileges of the Brahmans.' (p. 3)
- However, 'non-monarchical forms of government were omnipresent' (p. 6); 'it seems that in the northwestern part of India, republicanism was the norm.' (p. 7)
- 'But in many states, perhaps most, political participation was restricted to a subset of all the ksatriyas. 


Culture:
'The Pali Canon, and to some extent the Jaina Canon, show us energetic movements that rejected the hierarchialism and caste ideology seen in the Vedas and Brahmanas in favor of more egalitarian values.' (p. 15)
- 'egalitarianism was an important element in the fifth century B.C' (p. 15)

'The title rājā has frequently been translated as king rather than chief. In many cases the later meaning of the term is applied to these early sources. Yet even in later periods the connotation of rājā has varied from landholder to king. The office of rājā in the Vedic sources was primarily that of a leader in battle and the protector of the settlements.' (Romila Thapar (1991), p. 36)
","15th - 6th century BC
(1500 - 500 BC)",-1500,-500,"Asia, India (northeast)",,"Steven Muhlberger 1998. Democracy in Ancient India, https://uts.nipissingu.ca/muhlberger/histdem/indiadem.htm.

Stasavage, David (2020), The Decline and Rise of Democracy

Romila Thapar (1984), From Lineage to State: Social Formations of the Mid-First Millenium BC in the Ganga Valley

Benoy Kumar Sarkar, Democratic Ideals and Republican Institutions in India, The American Political Science Review , Nov., 1918, Vol. 12, No. 4

Rhys Davids is the pioneer of the study if ancient Indian republics. Sharma's book incorporates and updates his work.
Sharma 1968
","HETEROGENEITY
- Social groups : clearly divided into brahmins, Kshatriyas, vaishyas and sudras.
- Even though there was some degree of republicanism (informal inclusion), ""'in many states, perhaps most, political participation was restricted to a subset of all the ksatriyas . One needed to be not just a warrior, but a member of a specific royal clan, the rajanya' (p. 8)."" This, as well as the fact that the ruling raja class composes solely of Kshatriyas indicates that institutions were designed to allow for their domination (systemic imbalance)","Social groups,Inclusion through different institutions,Systemic power imbalance,Informal inclusion",Edited Jun 23 (one could follow up on Sharma's book on individual communities),,0,0,0,0,0,0,1,0,0,0,0,0,0,0,0,0,0,0,0,1,0,1,0,0,0,0,0,0,0,0,0,0,0,0,0,0,0,0,0,0,0,0,0,1,0,0,0,0,0,0,0,0,0,0,0,0,0,0,0,0,0,0,0,0,1,0,0,0,0,0,0,0,0,0,0,0,0,0,0,1,0,0,0,0,1,0,0,0,0,0,0,0,0,0,0,0,0,0,0,0,0,0,0,0,0,0,0,0,0,0,0,0,0,0,0,0,0,0,0,0,0,0,0,0,0,0,0,0,0,0,0,1,0,0,0,0,0,0,0,0,0,0,0,0,0,Asia,0,0,1,0,0,0,0,0,1000
Japan (Early Modern),"Shogun,Daimyo,Village Council,Samurai,Emperor","Consensus,Election,Council (local),Lottery/Random Selection,Magistrate/official,Autocratic Leader/Chief (bound),Autocratic Leader (unbound),Delegation,Heredity,Patronage (for office)","Loyalty/Patriotism,Egalitarianism,(TO APPROVE) Respect,Obedience to authority","Corporate Landholding (warichi)
The distribution of landholding within a village involved collective choice arrangements. 
The land in the village was converted into shares, or 'subsections comprising fields of equal productivity' by 'universal agreement' or consensus amongst them. 
'The number of shares in a village was generally determined by the families in the village.' (p. 446) 
These shares could then be bought, sold, leased and divided fractionally. For fractional shares, groups forming one share could elect a representative to 'draw lots on behalf of the jointly held share.' 
Following this, 'the members of the group subdivided among themselves the plots allocated to that share during the lottery.' (p. 447)

Culture
Though figures of authority lacked physical force to enforce their decisions, the long tradition of the 'filial relationship' wherein the samurai/daimyo/shogun was considered a father-figure, meant that there was a 'habit of deference to and respect for superiors.'  Thus, 'The daimyo might not actually govern, but the men who did govern did not try to displace him or undercut his prestige' (p.10) This indicates strong patterns of loyalty
[Hall, John Whitney, and Marius B. Jansen. Studies in the Institutional History of Early Modern Japan, Princeton University Press, 1968.]

- Autocratic leader/chief (bound) is a mechanism associated with the village headman, whose authority is restricted by the council. 
- King/Absolute monarch is a mechanism associated with the emperor, who, at least in theory, had complete power due to the belief that he was divinely appointed to rule. ",17-18th century AD ,1600,1800,"Asia, Japan","10,000,000+","Brown, Philip (2006), Arable Land as Commons: Land Reallocation in Early Modern Japan. Cambridge University Press

Hall, John Whitney, and Marius B. Jansen. Studies in the Institutional History of Early Modern Japan, Princeton University Press, 1968. ","There were around 27 provinces, controlled by either a shogun or a daimyo. Within a province, there were several villages. It is difficult to estimate the exact number of villages since the provinces were divided according to the amount of rice they produced and not the number of villages or the population. However, it can be roughly estimated that there were around 360 villages in each province based on its agricultural output. Each village had a council, which organised the corporate landholding process, as well as an assembly of all the citizens which voted on the distribution. 



HETEROGENEITY
- different socio-economic groups represented through the irrigation assembly and the political assembly
- there was little conflict of interest between the different socio-economic groups","Social groups,Inclusion through different institutions,Heterogenous without political cleavages,Formal inclusion",Edited May 23 (can use more information abut the mechanisms of the village council),,0,0,0,1,0,0,1,0,0,0,0,0,1,0,0,0,1,0,0,1,0,0,0,0,0,0,1,0,0,0,0,0,0,0,0,0,0,0,0,0,0,0,0,0,0,0,1,0,0,0,0,0,0,0,0,0,1,0,0,0,0,0,0,0,0,0,0,0,0,0,0,1,0,0,0,0,0,0,0,0,0,0,0,0,0,0,0,0,0,0,1,0,0,0,0,0,0,0,0,0,0,0,0,0,1,0,0,0,0,0,0,0,0,0,0,0,0,0,0,0,0,0,0,0,0,0,0,0,0,0,0,0,1,0,0,0,0,0,0,0,0,0,0,0,0,Asia,0,0,1,0,0,0,0,0,200
Kachin gumlao,"mung,Council of Elders,agyi,bawmung","Autocratic Leader/Chief (bound),Checks and balances,Blood relations,Council (local),Representation","Solidarity,Shared identity/Kinship,Egalitarianism","Egalitarianism in the gumlao
- The debt/tribute known as hka owed to the agyi in the form of agricultural produce was much lower than in the gumlao than in the aristocratic gumsa. ""The scale of compensation did not vary with the rank of the villager"" (pg. 205, Leach)
- Even this hka was distributed equally between the agyi, bawmung and Council. The Council members then gave it away to the families/lineages in most need of surplus crop. This was done after an unbiased consultation between the Elders and members would frequently give their share of the crop to another lineage in need, indicating altruism and solidarity. 
- Therefore, while the tribute system was considered a ""feudal"" practise by Leach in the gumsa, it was an instance of redistribution in the gumlao. 

Lineages and marriages 
- ""ideally a gumlao is endogamous and consists of three or more lineages marrying in a circle, each lineage having equal rights"" (pg 205, Leach)
- thus, a gumlao/village republic was ""likely to maintain a fiction of common clanship""",19th century,1800,1900,Asia Southeast,Unknown,"Mentioned in :
- James C. Scott, The Art of Not Being Governed
- Graeber, David and David Wengrow (2021), The Dawn of Everything

The Political Systems of Highland Burma: A Study of Kachin Social Structure, Edward Leach. ","It is difficult to estimate the exact size of the Kachin gumlao community, since it was not always clear in population censuses whether the Kachin community was a gumlao or a gumsa

HETEROGENEITY
-  Each member of the Council of Elders is associated with a lineage/ethnic group, and thus different ethnic groups are represented through the same institution 
- However, their decision making about the distribution of the hka illustrates that there is a high level of social cohesion
","Heterogenous without political cleavages,Ethnic/kinship groups,Inclusion through the same institution ,Formal inclusion",Edited May 23 (can use more information abut the mechanisms of the council of elders),,0,0,0,0,0,0,0,0,0,0,0,0,0,0,0,0,0,0,0,1,0,0,0,0,0,0,1,0,0,0,0,1,0,0,0,0,0,0,0,0,0,0,1,0,0,0,0,0,0,0,0,0,0,0,0,0,0,0,0,0,0,0,0,0,0,0,0,0,0,0,0,0,0,0,0,0,0,0,0,0,0,0,0,0,0,0,0,0,0,0,0,0,0,0,0,0,0,1,0,0,0,0,0,0,0,1,0,0,0,0,0,0,0,0,0,0,0,0,0,0,0,0,0,0,0,0,1,0,0,0,0,0,0,0,0,0,0,0,0,0,0,0,0,0,0,Asia,0,0,1,0,0,0,0,0,100
Khasi,"Mother,Ka Khatduh,U Kni,Durbar Iing,Durbar Kur,Syiem,Durbar Shnong","Leader (first among equals),Matriarchy,Blood relations,Matrilineality,Consensus,Council (local),Council (central) ,Autocratic Leader/Chief (bound),Representation","Solidarity,Egalitarianism,Gender equality,(TO APPROVE) Respect","o	‘Women are considered by these peoples not as weak, but as equally strong or even superior to the men.’ (46)
o	Both women and men participate in market activities
o	‘The mother is not only the progenitor and head of the clan, but in her role as family priest also embodies a unifying principle. Responsibility for all family rituals lies with her, including the enormously important ceremonies for the dead. She is also custodian of all clan property: the communal house and land, and the income from the work of all the clan members. She inherits her position of official successor to the previous clan mother— her own mother. She is custodian of the clan’s property—not with an eye to her own gain, but for the whole clan, for whose well-being she is responsible. She guides distribution of the common wealth, taking care that it is shared out equally, and according to the needs of each, in a give-and-take economy that could well be called a clan internal “gift economy.” Her responsibility is based on natural bonds, not on abstraction, since all of the clan members are her sisters and brothers, her daughters and sons, for whom she cares. In the clan house, among her close relatives she is possessed of a natural authority, rather than a power over them, as encountered in patriarchal domination roles, where people’s needs and wants are not considered. Natural authority means, on her part, giving advice and, on their part, voluntary choice about accepting it or not: a relationship that develops out of family respect. In the clan house she has no staff of enforcement (no police, no army) to make her suggestions into commands.’ (48)
o	‘All the Khasi subgroups follow the matrilineal principle of descent, succession and inheritance. That means, the children carry the name of the mother’s clan and are members of it. Today the father’s clan is also recognized, and is honored; however, the father’s lineage plays no role, as most of the Khasi continue to emphasize matrilinear kinship and solidarity.’ (48)
o	‘The clan’s property remains in the mother’s clan and is passed on from mother to daughter—with minor variation in the different subgroups. With the Khasi it is the youngest daughter, or “Ka Khatduh,” who takes over the entire ancestral property and the material as well as the spiritual responsibility for the “Kur,” or clan: it is the principle of ultima-geniture. She is supported by her eldest maternal uncle, who carries out the actual management and execution of clan property following the consensus of all clan members. The Ka Khatduh is now the new head and priestess of the clan (sub-clan, lineage) and begins her duties with the funeral rites for her revered dead mother, whose devoted support she was until the last.’ (48-49)
o	‘The clan house is the basic political unit, where decisions are made by consensus in the “Durbar Iing,” or family council, which then sends out senior male clan members to represent them in the “Durbar Kur,” or clan council. The clan councils in turn send male representatives out to the “Durbar Shnong,” or local council. The British colonial government later superimposed a district council, which is a formal justice institution; this took away from the local councils the power to settle cases by consensus.’ (51-52)
o	‘Every durbar meeting takes place only with the consensual agreement of the women: without their agreement, no decision can be made.’ (52)
o	‘Neither is the woman a ruler sui generis, rather she only has the right to make decisions in the context of the clan, conforming to its unwritten rules’ (52)
o	‘Matriarchal societies cannot be labeled as democracies—that is a much later political concept—but rather as consensual clan societies. This means that the decision- making process belongs to all the clan members; their discussions are summarized and brought to completion by the clan mother as chief authority, then represented at the village council by the clan mother’s brother. In this way the U Kni’s role is that of a delegate rather than a ruler. The clan would never permit him to exceed the boundaries of this purely executive role by taking steps of his own. In this sense matriarchies are characterized by non-domination of women even while they hold full economic and spiritual authority.’ (52)
o	‘The role of the Khasi head-persons is a good example: the oldest clans may install the “Syiems” (chiefs, or kings) in the various districts that comprise Khasi Land. Using the case of the well-researched district of Khyrim, we can outline the pattern of this “Syiemship.” The Syiem of Khyrim is the son of the “Syiem Sad,” the high priestess of Khyrim. Not he, but rather she, is the actual head of the people; she allows her son or nephew to act as her delegate. She owns the large royal house, in which a sacred column functions as an axis that designates the center of the (Khasi) world. Symbolically speaking, she lives right at the center of the world. Every official sacrifice ceremony begins through her, at the sacred column, and ends there as well. She is the keeper of the symbols: without the crown and all the sacred tools and sacrificial animals no sacrifice can be celebrated. She always performs the first sacrificial act in the house; afterwards, she turns the tools and the animals over to the Syiem, her son, and lets him continue the ceremony outside. This allows her to watch him from her house’ (53)
o	‘The power of women in the matriarchal official structure was not, however, limited to the Syiem Sad. In the history of the Khasi people there have been instances of female Syiems, or queens, who either performed both functions— priestess and executive—or else were daughters of a Syiem Sad’ (54)
o	After the arrival of the British, many self-governing matriarchal institutions were destroyed
","19th century (the community was formerly labeled as contemporary but some mechanisms functioned only until the 19th century and the coming of the British colonial forces so an earlier date has been preferred. the ""start"" date is difficult to establish)",1800,1900,"Asia, North-eastern India","1,000,001 - 10,000,000","Heide Goettner-Abendroth, Matriarchal Societies (2012)","HETEROGENEITY
Gender + Systemic power imbalance
The Mother and Ka Khatduh had greater decision making power and control over the affairs of the clan. Even though male members were represented in the the durbar (council) by being appointed U kni, ""the U Kni’s role is that of a delegate rather than a ruler. The clan would never permit him to exceed the boundaries of this purely executive role by taking steps of his own. (52)."" Even though a man is appointed syiem, ""Not he, but rather she, is the actual head of the people; she allows her son or nephew to act as her delegate.""
Thus there was a systemic power imbalance in favour of women. 

Ethnic kinship groups + Heterogeneity without a political cleavage
Different clans (matrilineal kinship groups) cooperated through durbars and resolved issues through consensus indicating the absence of a political cleavage. 
""The clan house is the basic political unit, where decisions are made by consensus in the “Durbar Iing,” or family council, which then sends out senior male clan members to represent them in the “Durbar Kur,” or clan council. The clan councils in turn send male representatives out to the “Durbar Shnong,” or local council.""
","Gender groups,Ethnic/kinship groups,Inclusion through different institutions,Formal inclusion,Systemic power imbalance,Heterogenous without political cleavages",Edited May 23 (can use more information abut the mechanisms of the various councils),,0,0,0,1,0,0,0,0,0,0,0,0,0,0,1,0,0,0,0,1,0,0,0,0,0,0,1,0,0,0,0,1,0,0,0,0,0,0,0,0,0,0,0,0,0,0,0,0,0,0,0,0,0,0,0,0,0,0,0,1,0,0,0,0,0,0,0,1,0,0,0,0,0,0,0,0,0,0,0,0,0,0,0,0,1,0,0,0,0,0,0,0,0,0,0,0,0,1,0,0,0,0,0,1,0,0,0,0,0,0,0,0,0,0,0,0,0,0,0,0,0,0,0,0,0,0,0,0,0,0,0,0,0,1,0,0,0,0,0,0,0,0,0,0,0,Asia,0,0,1,0,0,0,0,0,100
Latium,"Magistracies,Dictator,Priesthoods,Senate,Popular Assembly","Council (central) ,Assembly (central),Open political unit,Temporary position of power/Term Limits,Magistrate/official,Autocratic Leader/Chief (bound),Board/Committee,Election,Enfranchisement,Group voting",,"6th-4th century is the period in which city-states in Latium are independent, before coming under roman control, after the Latin war of 388. the municipal model of the latin city states is then used by Rome to shape colonies in the subsequent centuries (p. 209-11).

in the last decade of the 6th c. there were around 20 city-states in Latium (p. 212-3)

after the Latin war, the city states are incorporated into the Roman state with full citizenhsip (p. 213). they become self-governing municipia

The average size of the cities was 200 sq.km. and the average population was probably around 5000. (p. 215). [based on this, the size column refers to the single city-state. total size for the region needs to include smaller city states, ""with populations of 2000 or less (p. 215),"" Rome with a population of 35,000, and other larger city states like Veii, Tarquinia and Caere. the total was probably over 100,000.]

""what makes Latium unique among city-state societies is the high degree of interaction and mobility among individual city states. shared rights and privileges included the ius conubii on marriage, the ius commercii on legally binding contracts, and the ius migrationis on citizenship in other city states."" (p. 220)
Significant horizontal mobility across city states but vertical immobility across classes.

""the standard features [of political institutions in the city states] were annual magistracies, elected by a popular assemby, and a senate or council of former office holders."" (p. 221)

magistracies and priesthoods monopolized by a narrow circle of ruling families (p. 222). as in rome, a successful career would consist of a combination of religious and political offices.

As in Rome, manumission leads to citizenship. Also attested in the census (p. 224).

",6th - 4th century BC,-600,-300,"Europe South, Italy","1,001 - 10,000","Cornell, The City-States in Latium, in Hansen, A Comparative Study of Thirty City-State Cultures",,,Edited March 23,,1,0,0,0,0,0,0,0,0,0,0,0,0,0,0,0,1,0,1,1,0,0,0,0,0,0,0,0,0,0,0,0,0,0,0,0,0,0,0,0,0,0,0,1,0,0,0,0,0,0,0,0,0,0,0,0,0,0,0,0,0,0,1,0,0,0,0,0,0,0,1,0,0,0,0,0,0,0,0,0,0,0,0,0,1,0,1,0,0,0,1,0,0,0,0,0,0,0,0,0,1,0,0,0,0,0,0,0,0,0,0,0,0,0,0,0,0,0,0,0,0,1,0,0,0,0,0,0,0,0,0,0,0,0,0,0,0,0,0,0,0,0,0,0,0,Europe,0,1,0,0,0,0,0,0,300
